sr,case,turn_masked,agree/disagree,speaker_a_original,speaker_b_original,speaker_a_task_1,speaker_b_task_1,masked_word,llama_selection,gemma_pred,speaker_a_task_2,speaker_b_task_2,speaker_a_task_3,speaker_b_task_3,status,msg_id
1,modal,first,agree,I think it may be related to the enormity of the issue.,So of the issue would have been smaller we would have cared more?,I think it <b>WORD</b> be related to the enormity of the issue.,So of the issue would have been smaller we would have cared more?,may,could,must,I think it <b>MUST</b> be related to the enormity of the issue.,So of the issue would have been smaller we would have cared more?,I think it <b>MUST</b> be related to the enormity of the issue.,So of the issue would have been smaller we would have cared more?,Incomplete,gims2dv
2,modal,first,agree,"Switching to holistically-manawged animal products will actually contribute to carbon sequestration. Even the most ""sustainable"" veggie operations are still carbon-positive.","I'm surprised this is getting downvoted. I'd think that if someone was claiming a solution that I didn't know about I would at least be curious, even if it contradicted my ideologies.","Switching to holistically-manawged animal products <b>WORD</b> actually contribute to carbon sequestration. Even the most ""sustainable"" veggie operations are still carbon-positive.","I'm surprised this is getting downvoted. I'd think that if someone was claiming a solution that I didn't know about I would at least be curious, even if it contradicted my ideologies.",will,refuse,cannot,"Switching to holistically-manawged animal products <b>CANNOT</b> actually contribute to carbon sequestration. Even the most ""sustainable"" veggie operations are still carbon-positive.","I'm surprised this is getting downvoted. I'd think that if someone was claiming a solution that I didn't know about I would at least be curious, even if it contradicted my ideologies.","Switching to holistically-manawged animal products <b>CANNOT</b> actually contribute to carbon sequestration. Even the most ""sustainable"" veggie operations are still carbon-positive.","I'm surprised this is getting downvoted. I'd think that if someone was claiming a solution that I didn't know about I would at least be curious, even if it contradicted my ideologies.",Incomplete,erbh6jk
3,modal,first,agree,Humanity just might not be up to the job of climate change. Asking it to give up the civilization and lifestyle that fossil fuels afford is like asking bacteria to stop growing at the halfway point on a petri dish.,Only thing is humanity is the highest evolved kind of life on earth and we should do better than just bacteria... Somehow,Humanity just <b>WORD</b> not be up to the job of climate change. Asking it to give up the civilization and lifestyle that fossil fuels afford is like asking bacteria to stop growing at the halfway point on a petri dish.,Only thing is humanity is the highest evolved kind of life on earth and we should do better than just bacteria... Somehow,might,weakness,could,Humanity just <b>COULD</b> not be up to the job of climate change. Asking it to give up the civilization and lifestyle that fossil fuels afford is like asking bacteria to stop growing at the halfway point on a petri dish.,Only thing is humanity is the highest evolved kind of life on earth and we should do better than just bacteria... Somehow,Humanity just <b>COULD</b> not be up to the job of climate change. Asking it to give up the civilization and lifestyle that fossil fuels afford is like asking bacteria to stop growing at the halfway point on a petri dish.,Only thing is humanity is the highest evolved kind of life on earth and we should do better than just bacteria... Somehow,Incomplete,es98huq
4,modal,first,agree,"I'm hoping this won't be another Medicare for all situation where most people want it, but corporate donors don't let it happen.","Then it's up to the people to DEMAND it happen, boycott the companies.","I'm hoping this <b>WORD</b> be another Medicare for all situation where most people want it, but corporate donors don't let it happen.","Then it's up to the people to DEMAND it happen, boycott the companies.",won't,will,will,"I'm hoping this won't be another Medicare for all situation where most people want it, but corporate donors don't let it happen.","Then it's up to the people to DEMAND it happen, boycott the companies.","I'm hoping this won't be another Medicare for all situation where most people want it, but corporate donors don't let it happen.","Then it's up to the people to DEMAND it happen, boycott the companies.",Incomplete,gayes46
5,modal,first,agree,"When Boomer lives are at risk of coronavirus, we will destroy the global economy to help prevent disaster (as we should). When young and unborn generations are at risk of climate change, the economy is too important to make the necessary sacrifices to prevent disaster.",Except they dropped 1.5 trillion to save the market which is more important than the climate.,"When Boomer lives are at risk of coronavirus, we will destroy the global economy to help prevent disaster (as we <b>WORD</b>). When young and unborn generations are at risk of climate change, the economy is too important to make the necessary sacrifices to prevent disaster.",Except they dropped 1.5 trillion to save the market which is more important than the climate.,should,ought,mustn't,"When Boomer lives are at risk of coronavirus, we will destroy the global economy to help prevent disaster (as we <b>MUSTN'T</b>). When young and unborn generations are at risk of climate change, the economy is too important to make the necessary sacrifices to prevent disaster.",Except they dropped 1.5 trillion to save the market which is more important than the climate.,"When Boomer lives are at risk of coronavirus, we will destroy the global economy to help prevent disaster (as we <b>MUSTN'T</b>). When young and unborn generations are at risk of climate change, the economy is too important to make the necessary sacrifices to prevent disaster.",Except they dropped 1.5 trillion to save the market which is more important than the climate.,Incomplete,fkecvv6
6,modal,first,agree,"Just ""talk"", a person of her status, could be standing behind Greta and rally all her billionaires friends, but a tweet is all she could managed.","Yeah reading this I couldn't handle but think ""oh give me a break"".","Just ""talk"", a person of her status, could be standing behind Greta and rally all her billionaires friends, but a tweet is all she <b>WORD</b> managed.","Yeah reading this I couldn't handle but think ""oh give me a break"".",could,would,wouldn't,"Just ""talk"", a person of her status, could be standing behind Greta and rally all her billionaires friends, but a tweet is all she <b>WOULDN'T</b> managed.","Yeah reading this I couldn't handle but think ""oh give me a break"".","Just ""talk"", a person of her status, could be standing behind Greta and rally all her billionaires friends, but a tweet is all she <b>WOULDN'T</b> managed.","Yeah reading this I couldn't handle but think ""oh give me a break"".",Incomplete,fapi13j
7,modal,first,agree,"A president isn't supposed to be impeached for failing to respond to the most pressing issues in your opinion. He should have been impeached very early on for breaking a handful of other guidelines of the presidency, abusing the power of the office, and violating the Constitution. His climate policy is not something impeachable.","He rolled back regulations and 9,600 additional people a year have died from pollution in the United States because of it. He should be on trial for manslaughter, him and all his Republican supporters.","A president isn't supposed to be impeached for failing to respond to the most pressing issues in your opinion. He <b>WORD</b> have been impeached very early on for breaking a handful of other guidelines of the presidency, abusing the power of the office, and violating the Constitution. His climate policy is not something impeachable.","He rolled back regulations and 9,600 additional people a year have died from pollution in the United States because of it. He should be on trial for manslaughter, him and all his Republican supporters.",should,selected word not found,could,"A president isn't supposed to be impeached for failing to respond to the most pressing issues in your opinion. He <b>COULD</b> have been impeached very early on for breaking a handful of other guidelines of the presidency, abusing the power of the office, and violating the Constitution. His climate policy is not something impeachable.","He rolled back regulations and 9,600 additional people a year have died from pollution in the United States because of it. He should be on trial for manslaughter, him and all his Republican supporters.","A president isn't supposed to be impeached for failing to respond to the most pressing issues in your opinion. He <b>COULD</b> have been impeached very early on for breaking a handful of other guidelines of the presidency, abusing the power of the office, and violating the Constitution. His climate policy is not something impeachable.","He rolled back regulations and 9,600 additional people a year have died from pollution in the United States because of it. He should be on trial for manslaughter, him and all his Republican supporters.",Incomplete,f5abber
8,modal,first,agree,"If the Arctic fully melts (as it is likely not to do) then the Earth enters a different climate state and it will warm until it reaches equilibrium, which might not happen for decades or centuries.","The Earth will warm until it reaches equilibrium, which might not happen for decades or centuries. Already true.","If the Arctic fully melts (as it is <b>WORD</b> not to do) then the Earth enters a different climate state and it will warm until it reaches equilibrium, which might not happen for decades or centuries.","The Earth will warm until it reaches equilibrium, which might not happen for decades or centuries. Already true.",likely,impossible,unlikely,"If the Arctic fully melts (as it is <b>UNLIKELY</b> not to do) then the Earth enters a different climate state and it will warm until it reaches equilibrium, which might not happen for decades or centuries.","The Earth will warm until it reaches equilibrium, which might not happen for decades or centuries. Already true.","If the Arctic fully melts (as it is <b>UNLIKELY</b> not to do) then the Earth enters a different climate state and it will warm until it reaches equilibrium, which might not happen for decades or centuries.","The Earth will warm until it reaches equilibrium, which might not happen for decades or centuries. Already true.",Incomplete,d32ilac
9,modal,first,agree,If there's an unbroken chain of record warm that should be telling something. The next five years most likely will also been the Earth's warmest since records began.,"People should understand that taking care of our climate is no more an option for us. This ""needs"" to be taken care of with utmost importance and diligence, starting right now.",If there's an unbroken chain of record warm that should be telling something. The next five years most <b>WORD</b> will also been the Earth's warmest since records began.,"People should understand that taking care of our climate is no more an option for us. This ""needs"" to be taken care of with utmost importance and diligence, starting right now.",likely,unlikely,unlikely,If there's an unbroken chain of record warm that should be telling something. The next five years most <b>UNLIKELY</b> will also been the Earth's warmest since records began.,"People should understand that taking care of our climate is no more an option for us. This ""needs"" to be taken care of with utmost importance and diligence, starting right now.",If there's an unbroken chain of record warm that should be telling something. The next five years most <b>UNLIKELY</b> will also been the Earth's warmest since records began.,"People should understand that taking care of our climate is no more an option for us. This ""needs"" to be taken care of with utmost importance and diligence, starting right now.",Incomplete,egdr9qu
10,modal,first,agree,"It's important to understand that winning elections is not the *primary* goal of the Democratic Party establishment. They're paid by wealthy donors to ensure that progressive policies which threaten wealth and power don't get implemented. So the real question is either whether people who fund the party have a near term financial interest in progressive climate policy, or whether it's possible for regular people to take back control of the party.",Great take. Electoralism is inherently a limited strategy to address climate.,"It's important to understand that winning elections is not the *primary* goal of the Democratic Party establishment. They're paid by wealthy donors to ensure that progressive policies which threaten wealth and power don't get implemented. So the real question is either whether people who fund the party have a near term financial interest in progressive climate policy, <b>WORD</b> whether it's possible for regular people to take back control of the party.",Great take. Electoralism is inherently a limited strategy to address climate.,or,but,and,"It's important to understand that winning elections is not the *primary* goal of the Democratic Party establishment. They're paid by wealthy donors to ensure that progressive policies which threaten wealth and power don't get implemented. So the real question is either whether people who fund the party have a near term financial interest in progressive climate policy, <b>AND</b> whether it's possible for regular people to take back control of the party.",Great take. Electoralism is inherently a limited strategy to address climate.,"It's important to understand that winning elections is not the *primary* goal of the Democratic Party establishment. They're paid by wealthy donors to ensure that progressive policies which threaten wealth and power don't get implemented. So the real question is either whether people who fund the party have a near term financial interest in progressive climate policy, <b>AND</b> whether it's possible for regular people to take back control of the party.",Great take. Electoralism is inherently a limited strategy to address climate.,Incomplete,e9k2xsm
11,modal,first,disagree,"Should we spend that money on cleaning up other countries? We (U.S.A.) have virtually eliminated smog from automobiles, cleaned up the toxic dump that was the Great Lakes. The Mississippi River is under control and the EPA has made it almost impossible to start new businesses. No way that 1.5T will develop the technology to get us off of fossil fuels. What specifically can be done?","Yes, obviously for trashing their countries in the name of profit. How do you think we were able to afford to make the sacrifices to clean up those problems in our backyard.","Should we spend that money on cleaning up other countries? We (U.S.A.) have virtually eliminated smog from automobiles, cleaned up the toxic dump that was the Great Lakes. The Mississippi River is under control and the EPA has made it almost <b>WORD</b> to start new businesses. No way that 1.5T will develop the technology to get us off of fossil fuels. What specifically can be done?","Yes, obviously for trashing their countries in the name of profit. How do you think we were able to afford to make the sacrifices to clean up those problems in our backyard.",impossible,easy,easy,"Should we spend that money on cleaning up other countries? We (U.S.A.) have virtually eliminated smog from automobiles, cleaned up the toxic dump that was the Great Lakes. The Mississippi River is under control and the EPA has made it almost <b>EASY</b> to start new businesses. No way that 1.5T will develop the technology to get us off of fossil fuels. What specifically can be done?","Yes, obviously for trashing their countries in the name of profit. How do you think we were able to afford to make the sacrifices to clean up those problems in our backyard.","Should we spend that money on cleaning up other countries? We (U.S.A.) have virtually eliminated smog from automobiles, cleaned up the toxic dump that was the Great Lakes. The Mississippi River is under control and the EPA has made it almost <b>EASY</b> to start new businesses. No way that 1.5T will develop the technology to get us off of fossil fuels. What specifically can be done?","Yes, obviously for trashing their countries in the name of profit. How do you think we were able to afford to make the sacrifices to clean up those problems in our backyard.",Incomplete,eudvijb
12,modal,first,disagree,"A carbon tax will help us get there. Right now beef is subsidized to hell, not even considering the impact it has on the climate. If we end the subsidies, pass a carbon tax, and start subsidizing plant based alternatives, the market will phase most beef out for us.",You mean only Richie Rich will be able to afford it.,"A carbon tax will help us get there. Right now beef is subsidized to hell, not even considering the impact it has on the climate. If we end the subsidies, pass a carbon tax, and start subsidizing plant based alternatives, the market <b>WORD</b> phase most beef out for us.",You mean only Richie Rich will be able to afford it.,will,cannot,could,"A carbon tax will help us get there. Right now beef is subsidized to hell, not even considering the impact it has on the climate. If we end the subsidies, pass a carbon tax, and start subsidizing plant based alternatives, the market <b>COULD</b> phase most beef out for us.",You mean only Richie Rich will be able to afford it.,"A carbon tax will help us get there. Right now beef is subsidized to hell, not even considering the impact it has on the climate. If we end the subsidies, pass a carbon tax, and start subsidizing plant based alternatives, the market <b>COULD</b> phase most beef out for us.",You mean only Richie Rich will be able to afford it.,Incomplete,go3gnt7
13,modal,first,disagree,Can we do something about spam mail? It could probably shorten the time that USPS workers are out delivering.,"Impossible. The USPS makes a ton of money via mailing advertisements. I haven't checked, but I would not be so surprised to find that they make MOST of their money this way.",Can we do something about spam mail? It could <b>WORD</b> shorten the time that USPS workers are out delivering.,"Impossible. The USPS makes a ton of money via mailing advertisements. I haven't checked, but I would not be so surprised to find that they make MOST of their money this way.",probably,definitely,definitely,Can we do something about spam mail? It could <b>DEFINITELY</b> shorten the time that USPS workers are out delivering.,"Impossible. The USPS makes a ton of money via mailing advertisements. I haven't checked, but I would not be so surprised to find that they make MOST of their money this way.",Can we do something about spam mail? It could <b>DEFINITELY</b> shorten the time that USPS workers are out delivering.,"Impossible. The USPS makes a ton of money via mailing advertisements. I haven't checked, but I would not be so surprised to find that they make MOST of their money this way.",Incomplete,fybkhie
14,modal,first,disagree,"It's been predicted for several years now that lower Arctic summer ice levels would allow for faster shipping, which can mean for decreased emissions as well. I'm curious as to how the aerosols from the ships would affect the Arctic considering they're spraying them right in the area.",That prediction only works if the quantity of freight stays the same or goes down.,"It's been predicted for several years now that lower Arctic summer ice levels <b>WORD</b> allow for faster shipping, which can mean for decreased emissions as well. I'm curious as to how the aerosols from the ships would affect the Arctic considering they're spraying them right in the area.",That prediction only works if the quantity of freight stays the same or goes down.,would,could,could,"It's been predicted for several years now that lower Arctic summer ice levels <b>COULD</b> allow for faster shipping, which can mean for decreased emissions as well. I'm curious as to how the aerosols from the ships would affect the Arctic considering they're spraying them right in the area.",That prediction only works if the quantity of freight stays the same or goes down.,"It's been predicted for several years now that lower Arctic summer ice levels <b>COULD</b> allow for faster shipping, which can mean for decreased emissions as well. I'm curious as to how the aerosols from the ships would affect the Arctic considering they're spraying them right in the area.",That prediction only works if the quantity of freight stays the same or goes down.,Incomplete,g1wpb4a
15,modal,first,disagree,We are entering a period of massive depopulation in the next 20-70 years that is already baked in due to demographic change. We're talking a halving of the global population by 2150. 1/2 countries in the world have sub-replacement rate fertility and nearly 10 will halve by 2100.,"This is not true, how is it baked in? People are being born faster than people are dying and that won't change anytime soon",We are entering a period of massive depopulation in the next 20-70 years that is already baked in due to demographic change. We're talking a halving of the global population by 2150. 1/2 countries in the world have sub-replacement rate fertility and nearly 10 <b>WORD</b> halve by 2100.,"This is not true, how is it baked in? People are being born faster than people are dying and that won't change anytime soon",will,cannot,cannot,We are entering a period of massive depopulation in the next 20-70 years that is already baked in due to demographic change. We're talking a halving of the global population by 2150. 1/2 countries in the world have sub-replacement rate fertility and nearly 10 <b>CANNOT</b> halve by 2100.,"This is not true, how is it baked in? People are being born faster than people are dying and that won't change anytime soon",We are entering a period of massive depopulation in the next 20-70 years that is already baked in due to demographic change. We're talking a halving of the global population by 2150. 1/2 countries in the world have sub-replacement rate fertility and nearly 10 <b>CANNOT</b> halve by 2100.,"This is not true, how is it baked in? People are being born faster than people are dying and that won't change anytime soon",Incomplete,gyc1uas
16,modal,first,disagree,"Trump Fires NOAA's Chief Scientist But Biden will reappoint him without doubt, I hope.","Depends on if he wants it or not. 3 months without work is a fair-sized gap, and somebody with his experience may have found an academic position or the likes in the meantime.","Trump Fires NOAA's Chief Scientist But Biden will reappoint him without <b>WORD</b>, I hope.","Depends on if he wants it or not. 3 months without work is a fair-sized gap, and somebody with his experience may have found an academic position or the likes in the meantime.",doubt,certainty,certainty,"Trump Fires NOAA's Chief Scientist But Biden will reappoint him without <b>CERTAINTY</b>, I hope.","Depends on if he wants it or not. 3 months without work is a fair-sized gap, and somebody with his experience may have found an academic position or the likes in the meantime.","Trump Fires NOAA's Chief Scientist But Biden will reappoint him without <b>CERTAINTY</b>, I hope.","Depends on if he wants it or not. 3 months without work is a fair-sized gap, and somebody with his experience may have found an academic position or the likes in the meantime.",Incomplete,gaydyj5
