sr,case,turn_masked,agree/disagree,speaker_a_original,speaker_b_original,speaker_a_task_1,speaker_b_task_1,masked_word,llama_selection,gemma_pred,speaker_a_task_2,speaker_b_task_2,speaker_a_task_3,speaker_b_task_3,status,msg_id
281,quantifier,first,agree,"Make no mistake, there will be all manner of excuses from his type, and they will all be directly related to greed.","Exactly this is just the next stage of a strategy to deny, dismiss, and disenfranchise with the only intent of preserving profits and any cost.","Make no mistake, there will be <b>WORD</b> manner of excuses from his type, and they will all be directly related to greed.","Exactly this is just the next stage of a strategy to deny, dismiss, and disenfranchise with the only intent of preserving profits and any cost.",all,none,deep,"Make no mistake, there will be <b>DEEP</b> manner of excuses from his type, and they will all be directly related to greed.","Exactly this is just the next stage of a strategy to deny, dismiss, and disenfranchise with the only intent of preserving profits and any cost.","Make no mistake, there will be <b>DEEP</b> manner of excuses from his type, and they will all be directly related to greed.","Exactly this is just the next stage of a strategy to deny, dismiss, and disenfranchise with the only intent of preserving profits and any cost.",Incomplete,f8f8ugt
282,quantifier,first,agree,She has no concept of US politics. Why even put her on the spotlight other than to use her as a mascot for an agenda?,"This is such an obvious point but this group will downvote you anyway. She is a child. It's silly to take her seriously, she's obviously a propaganda doll, and her parents are despicable, especially her mom. Why people listen to children about issues they obviously have no expertise in baffles me. I presume it's mostly people who haven't raised children or who raised them way too indulgently.",She has <b>WORD</b> concept of US politics. Why even put her on the spotlight other than to use her as a mascot for an agenda?,"This is such an obvious point but this group will downvote you anyway. She is a child. It's silly to take her seriously, she's obviously a propaganda doll, and her parents are despicable, especially her mom. Why people listen to children about issues they obviously have no expertise in baffles me. I presume it's mostly people who haven't raised children or who raised them way too indulgently.",no,vast,nothing,She has <b>NOTHING</b> concept of US politics. Why even put her on the spotlight other than to use her as a mascot for an agenda?,"This is such an obvious point but this group will downvote you anyway. She is a child. It's silly to take her seriously, she's obviously a propaganda doll, and her parents are despicable, especially her mom. Why people listen to children about issues they obviously have no expertise in baffles me. I presume it's mostly people who haven't raised children or who raised them way too indulgently.",She has <b>NOTHING</b> concept of US politics. Why even put her on the spotlight other than to use her as a mascot for an agenda?,"This is such an obvious point but this group will downvote you anyway. She is a child. It's silly to take her seriously, she's obviously a propaganda doll, and her parents are despicable, especially her mom. Why people listen to children about issues they obviously have no expertise in baffles me. I presume it's mostly people who haven't raised children or who raised them way too indulgently.",Incomplete,gc40mhs
283,quantifier,first,agree,"I have a lot of respect for Greta Thunberg, but damn, when does this girl have time to do anything kid like? I really can't imagine this is good for her as a person to live this way, but i appreciate her dedication and sacrifice for what i believe to be a worthy cause. It's just been like 2 years now",She's been back at school for at least a few weeks now. And I have felt the same about her childhood and her wellbeing but I think it's possible that she is infact quite a brilliant mind and is well aware of the sacrifice she is making,"I have a lot of respect for Greta Thunberg, but damn, when does this girl have time to do <b>WORD</b> kid like? I really can't imagine this is good for her as a person to live this way, but i appreciate her dedication and sacrifice for what i believe to be a worthy cause. It's just been like 2 years now",She's been back at school for at least a few weeks now. And I have felt the same about her childhood and her wellbeing but I think it's possible that she is infact quite a brilliant mind and is well aware of the sacrifice she is making,anything,nothing,vitamins,"I have a lot of respect for Greta Thunberg, but damn, when does this girl have time to do <b>VITAMINS</b> kid like? I really can't imagine this is good for her as a person to live this way, but i appreciate her dedication and sacrifice for what i believe to be a worthy cause. It's just been like 2 years now",She's been back at school for at least a few weeks now. And I have felt the same about her childhood and her wellbeing but I think it's possible that she is infact quite a brilliant mind and is well aware of the sacrifice she is making,"I have a lot of respect for Greta Thunberg, but damn, when does this girl have time to do <b>VITAMINS</b> kid like? I really can't imagine this is good for her as a person to live this way, but i appreciate her dedication and sacrifice for what i believe to be a worthy cause. It's just been like 2 years now",She's been back at school for at least a few weeks now. And I have felt the same about her childhood and her wellbeing but I think it's possible that she is infact quite a brilliant mind and is well aware of the sacrifice she is making,Incomplete,g4gidzw
284,quantifier,first,agree,"It's all about balance. Meat is good for iron and protein, and plants are good for everything else. I don't eat meat all the time, but instead I eat it about once a week.","Actually you can eat meat every day as long as it comes from an independent or local farm, because that's what helps avoid the pitfalls in the title.","It's all about balance. Meat is good for iron and protein, and plants are good for <b>WORD</b> else. I don't eat meat all the time, but instead I eat it about once a week.","Actually you can eat meat every day as long as it comes from an independent or local farm, because that's what helps avoid the pitfalls in the title.",everything,nothing,nobody,"It's all about balance. Meat is good for iron and protein, and plants are good for <b>NOBODY</b> else. I don't eat meat all the time, but instead I eat it about once a week.","Actually you can eat meat every day as long as it comes from an independent or local farm, because that's what helps avoid the pitfalls in the title.","It's all about balance. Meat is good for iron and protein, and plants are good for <b>NOBODY</b> else. I don't eat meat all the time, but instead I eat it about once a week.","Actually you can eat meat every day as long as it comes from an independent or local farm, because that's what helps avoid the pitfalls in the title.",Incomplete,frejp2d
285,quantifier,first,agree,"This does a commendable job of framing anyone concerned about climate as a looney, Prius driving celery scarfer who wants to steal your hamburgers and classic cars.","Sadly for the human species we will eventually stop consuming this much meat, by a lot. It will be too late, and it'll be abrupt, but we will do it. I think it is effectively impossible to avoid looking like a looney to ""common sense Americans,"" while telling the honest to god truth.","This does a commendable job of framing <b>WORD</b> concerned about climate as a looney, Prius driving celery scarfer who wants to steal your hamburgers and classic cars.","Sadly for the human species we will eventually stop consuming this much meat, by a lot. It will be too late, and it'll be abrupt, but we will do it. I think it is effectively impossible to avoid looking like a looney to ""common sense Americans,"" while telling the honest to god truth.",anyone,no one,few,"This does a commendable job of framing <b>FEW</b> concerned about climate as a looney, Prius driving celery scarfer who wants to steal your hamburgers and classic cars.","Sadly for the human species we will eventually stop consuming this much meat, by a lot. It will be too late, and it'll be abrupt, but we will do it. I think it is effectively impossible to avoid looking like a looney to ""common sense Americans,"" while telling the honest to god truth.","This does a commendable job of framing <b>FEW</b> concerned about climate as a looney, Prius driving celery scarfer who wants to steal your hamburgers and classic cars.","Sadly for the human species we will eventually stop consuming this much meat, by a lot. It will be too late, and it'll be abrupt, but we will do it. I think it is effectively impossible to avoid looking like a looney to ""common sense Americans,"" while telling the honest to god truth.",Incomplete,gw3htdv
286,quantifier,first,agree,"So ban on ICE vehicles by 2025, food waste in grocery stores is illegal, all new power must be renewable, and install as many of those CO2 capture plants as possible.","Making animal products illegal gets you the same effect as all of that, lower health care costs and frees half the continental us for re-foresting.","So ban on ICE vehicles by 2025, food waste in grocery stores is illegal, all new power must be renewable, and install as <b>WORD</b> of those CO2 capture plants as possible.","Making animal products illegal gets you the same effect as all of that, lower health care costs and frees half the continental us for re-foresting.",many,few,few,"So ban on ICE vehicles by 2025, food waste in grocery stores is illegal, all new power must be renewable, and install as <b>FEW</b> of those CO2 capture plants as possible.","Making animal products illegal gets you the same effect as all of that, lower health care costs and frees half the continental us for re-foresting.","So ban on ICE vehicles by 2025, food waste in grocery stores is illegal, all new power must be renewable, and install as <b>FEW</b> of those CO2 capture plants as possible.","Making animal products illegal gets you the same effect as all of that, lower health care costs and frees half the continental us for re-foresting.",Incomplete,doy614p
287,quantifier,first,agree,"Rationally, we shouldn't ""need"" people like Greta Thunberg, but I deeply admire her for the role she took on herself. I also admire her for taking a stand against the myth that overpopulation is the cause of all our problems.",Bit sad though she should just be able to live a normal life without feeling responsibility for the entire planet,"Rationally, we shouldn't ""need"" people like Greta Thunberg, but I deeply admire her for the role she took on herself. I also admire her for taking a stand against the myth that overpopulation is the cause of <b>WORD</b> our problems.",Bit sad though she should just be able to live a normal life without feeling responsibility for the entire planet,all,none,all,"Rationally, we shouldn't ""need"" people like Greta Thunberg, but I deeply admire her for the role she took on herself. I also admire her for taking a stand against the myth that overpopulation is the cause of <b>ALL</b> our problems.",Bit sad though she should just be able to live a normal life without feeling responsibility for the entire planet,"Rationally, we shouldn't ""need"" people like Greta Thunberg, but I deeply admire her for the role she took on herself. I also admire her for taking a stand against the myth that overpopulation is the cause of <b>ALL</b> our problems.",Bit sad though she should just be able to live a normal life without feeling responsibility for the entire planet,Incomplete,ghyqsf3
288,quantifier,first,agree,we've had a revenue neutral carbon tax in BC for some years now and it's been a success.,"I use this example often to ""prove"" it's possible to do what we all know needs to be done.",we've had a revenue neutral carbon tax in BC for <b>WORD</b> years now and it's been a success.,"I use this example often to ""prove"" it's possible to do what we all know needs to be done.",some,many,all,we've had a revenue neutral carbon tax in BC for <b>ALL</b> years now and it's been a success.,"I use this example often to ""prove"" it's possible to do what we all know needs to be done.",we've had a revenue neutral carbon tax in BC for <b>ALL</b> years now and it's been a success.,"I use this example often to ""prove"" it's possible to do what we all know needs to be done.",Incomplete,dy7026s
289,quantifier,first,agree,This sort of story is tokenistic bullshit that distracts from the substance being discussed. It is moralistic grandstanding against some of the people actually trying to get shit done.,"Maybe for you it's moralistic grandstanding but, for many people who think simply, it's the confirmation that our leaders ask us to sacrifice while the upper class indulges in carbon intensive lifestyles.",This sort of story is tokenistic bullshit that distracts from the substance being discussed. It is moralistic grandstanding against <b>WORD</b> of the people actually trying to get shit done.,"Maybe for you it's moralistic grandstanding but, for many people who think simply, it's the confirmation that our leaders ask us to sacrifice while the upper class indulges in carbon intensive lifestyles.",some,few,least,This sort of story is tokenistic bullshit that distracts from the substance being discussed. It is moralistic grandstanding against <b>LEAST</b> of the people actually trying to get shit done.,"Maybe for you it's moralistic grandstanding but, for many people who think simply, it's the confirmation that our leaders ask us to sacrifice while the upper class indulges in carbon intensive lifestyles.",This sort of story is tokenistic bullshit that distracts from the substance being discussed. It is moralistic grandstanding against <b>LEAST</b> of the people actually trying to get shit done.,"Maybe for you it's moralistic grandstanding but, for many people who think simply, it's the confirmation that our leaders ask us to sacrifice while the upper class indulges in carbon intensive lifestyles.",Incomplete,eb6ncn8
290,quantifier,first,agree,"What made you convinced that you were overestimating and how do you know you've got it right now? I'm genuinely curious - my own stance fluctuates with my mood, from slight optimism to severe pessimism. I mean most of data shows that it is pretty bad and probably beyond repair, but I'd really like to be convinced otherwise.","I feel the same. Some does when I read articles I think ""We've got this nailed"" and other times ""Oh man we really did it.""","What made you convinced that you were overestimating and how do you know you've got it right now? I'm genuinely curious - my own stance fluctuates with my mood, from slight optimism to severe pessimism. I mean <b>WORD</b> of data shows that it is pretty bad and probably beyond repair, but I'd really like to be convinced otherwise.","I feel the same. Some does when I read articles I think ""We've got this nailed"" and other times ""Oh man we really did it.""",most,least,zero,"What made you convinced that you were overestimating and how do you know you've got it right now? I'm genuinely curious - my own stance fluctuates with my mood, from slight optimism to severe pessimism. I mean <b>ZERO</b> of data shows that it is pretty bad and probably beyond repair, but I'd really like to be convinced otherwise.","I feel the same. Some does when I read articles I think ""We've got this nailed"" and other times ""Oh man we really did it.""","What made you convinced that you were overestimating and how do you know you've got it right now? I'm genuinely curious - my own stance fluctuates with my mood, from slight optimism to severe pessimism. I mean <b>ZERO</b> of data shows that it is pretty bad and probably beyond repair, but I'd really like to be convinced otherwise.","I feel the same. Some does when I read articles I think ""We've got this nailed"" and other times ""Oh man we really did it.""",Incomplete,f8hedvk
291,quantifier,first,disagree,Bernie has a plan too. But unlike Liz he has non-zero chance to win primaries and election.,Does he have a plan that covers waterways and marine life yet? What's his plan for curbing corporate waste? The last time I checked he didn' thave plans that covered either.,Bernie has a plan too. But unlike Liz he has <b>WORD</b> chance to win primaries and election.,Does he have a plan that covers waterways and marine life yet? What's his plan for curbing corporate waste? The last time I checked he didn' thave plans that covered either.,non-zero,zero,nothing,Bernie has a plan too. But unlike Liz he has <b>NOTHING</b> chance to win primaries and election.,Does he have a plan that covers waterways and marine life yet? What's his plan for curbing corporate waste? The last time I checked he didn' thave plans that covered either.,Bernie has a plan too. But unlike Liz he has <b>NOTHING</b> chance to win primaries and election.,Does he have a plan that covers waterways and marine life yet? What's his plan for curbing corporate waste? The last time I checked he didn' thave plans that covered either.,Incomplete,fhronw0
292,quantifier,first,disagree,She is a god believer and Republican. You shouldn't post anything she says. She shouldn't get any attention she so desperately desires!,"On the other hand, those sorts of people are probably more likely to listen to her.",She is a god believer and Republican. You shouldn't post <b>WORD</b> she says. She shouldn't get any attention she so desperately desires!,"On the other hand, those sorts of people are probably more likely to listen to her.",anything,nothing,never,She is a god believer and Republican. You shouldn't post <b>NEVER</b> she says. She shouldn't get any attention she so desperately desires!,"On the other hand, those sorts of people are probably more likely to listen to her.",She is a god believer and Republican. You shouldn't post <b>NEVER</b> she says. She shouldn't get any attention she so desperately desires!,"On the other hand, those sorts of people are probably more likely to listen to her.",Incomplete,dafk9ax
293,quantifier,first,disagree,"Problem is, even authors like Naomi Klein are minimizing the problem and suggest that we can ""solve"" it. Yes we could, but we'd need to get rid of a couple billion people and reduce our living standards severely. Exerting an irresistible force against an unmoving object is always an interesting process.","She's better than most though. Saying things like we need to redefine the economy and completely change the status quo, makes her better than the ""renewables will save us all"" crowd.","Problem is, even authors like Naomi Klein are minimizing the problem and suggest that we can ""solve"" it. Yes we could, but we'd need to get rid of a couple billion people and reduce our living standards severely. Exerting an irresistible force against an unmoving object is <b>WORD</b> an interesting process.","She's better than most though. Saying things like we need to redefine the economy and completely change the status quo, makes her better than the ""renewables will save us all"" crowd.",always,rarely,constructive,"Problem is, even authors like Naomi Klein are minimizing the problem and suggest that we can ""solve"" it. Yes we could, but we'd need to get rid of a couple billion people and reduce our living standards severely. Exerting an irresistible force against an unmoving object is <b>CONSTRUCTIVE</b> an interesting process.","She's better than most though. Saying things like we need to redefine the economy and completely change the status quo, makes her better than the ""renewables will save us all"" crowd.","Problem is, even authors like Naomi Klein are minimizing the problem and suggest that we can ""solve"" it. Yes we could, but we'd need to get rid of a couple billion people and reduce our living standards severely. Exerting an irresistible force against an unmoving object is <b>CONSTRUCTIVE</b> an interesting process.","She's better than most though. Saying things like we need to redefine the economy and completely change the status quo, makes her better than the ""renewables will save us all"" crowd.",Incomplete,cp6svfa
294,quantifier,first,disagree,My daughter is ten years old- she will be marching with me when and striking with my approval- we all need to be supporting these students in any way we can. Fuck those who criticise or stand in our way. History is not on their side,"Neglecting your daughter's education to protest something makes no sense to me. There are much more effective ways to do this, without encouraging possibly damaging behavior. But you do you.",My daughter is ten years old- she will be marching with me when and striking with my approval- we all need to be supporting these students in <b>WORD</b> way we can. Fuck those who criticise or stand in our way. History is not on their side,"Neglecting your daughter's education to protest something makes no sense to me. There are much more effective ways to do this, without encouraging possibly damaging behavior. But you do you.",any,none,all,My daughter is ten years old- she will be marching with me when and striking with my approval- we all need to be supporting these students in <b>ALL</b> way we can. Fuck those who criticise or stand in our way. History is not on their side,"Neglecting your daughter's education to protest something makes no sense to me. There are much more effective ways to do this, without encouraging possibly damaging behavior. But you do you.",My daughter is ten years old- she will be marching with me when and striking with my approval- we all need to be supporting these students in <b>ALL</b> way we can. Fuck those who criticise or stand in our way. History is not on their side,"Neglecting your daughter's education to protest something makes no sense to me. There are much more effective ways to do this, without encouraging possibly damaging behavior. But you do you.",Incomplete,eifsr54
295,quantifier,first,disagree,"Her dad could have given her some pointers on acting, surely?",She isn't acting. This is called passion. Maybe you can't recognize it because you have nothing to be passionate about.,"Her dad could have given her <b>WORD</b> pointers on acting, surely?",She isn't acting. This is called passion. Maybe you can't recognize it because you have nothing to be passionate about.,some,none,all,"Her dad could have given her <b>ALL</b> pointers on acting, surely?",She isn't acting. This is called passion. Maybe you can't recognize it because you have nothing to be passionate about.,"Her dad could have given her <b>ALL</b> pointers on acting, surely?",She isn't acting. This is called passion. Maybe you can't recognize it because you have nothing to be passionate about.,Incomplete,f19tq2e
296,quantifier,first,disagree,Clearly a hoax by the Chinese to impede American competition... Trump needs to watch a few documentaries and get some actual scientists in his circle.,"No one cares about that lame denier joke anymore, hillary wasn't going to do the required when it came to climate change either.",Clearly a hoax by the Chinese to impede American competition... Trump needs to watch a few documentaries and get <b>WORD</b> actual scientists in his circle.,"No one cares about that lame denier joke anymore, hillary wasn't going to do the required when it came to climate change either.",some,few,few,Clearly a hoax by the Chinese to impede American competition... Trump needs to watch a few documentaries and get <b>FEW</b> actual scientists in his circle.,"No one cares about that lame denier joke anymore, hillary wasn't going to do the required when it came to climate change either.",Clearly a hoax by the Chinese to impede American competition... Trump needs to watch a few documentaries and get <b>FEW</b> actual scientists in his circle.,"No one cares about that lame denier joke anymore, hillary wasn't going to do the required when it came to climate change either.",Incomplete,daj4eus
297,quantifier,first,disagree,"Who is willing to do what it takes? Who is going to cut down meat consumption by half, switch all power plants to renewable in 25 years, require home efficiency standards for new AND old homes? Who?","Me, you, nearly all of us. It's much easier than you make it sound. Cutting ""meat"" consumption is mostly about switching from beef, which simply means raising its price to account for externalities.","Who is willing to do what it takes? Who is going to cut down meat consumption by half, switch <b>WORD</b> power plants to renewable in 25 years, require home efficiency standards for new AND old homes? Who?","Me, you, nearly all of us. It's much easier than you make it sound. Cutting ""meat"" consumption is mostly about switching from beef, which simply means raising its price to account for externalities.",all,few,least,"Who is willing to do what it takes? Who is going to cut down meat consumption by half, switch <b>LEAST</b> power plants to renewable in 25 years, require home efficiency standards for new AND old homes? Who?","Me, you, nearly all of us. It's much easier than you make it sound. Cutting ""meat"" consumption is mostly about switching from beef, which simply means raising its price to account for externalities.","Who is willing to do what it takes? Who is going to cut down meat consumption by half, switch <b>LEAST</b> power plants to renewable in 25 years, require home efficiency standards for new AND old homes? Who?","Me, you, nearly all of us. It's much easier than you make it sound. Cutting ""meat"" consumption is mostly about switching from beef, which simply means raising its price to account for externalities.",Incomplete,cxj49oc
