sr,case,turn_masked,agree/disagree,speaker_a_original,speaker_b_original,speaker_a_task_1,speaker_b_task_1,masked_word,llama_selection,gemma_pred,speaker_a_task_2,speaker_b_task_2,speaker_a_task_3,speaker_b_task_3,status,msg_id
94,verb,first,disagree,How can a decent person personally attack a child for speaking out against injustice? I expect this is a distraction from actually discussion policy.,They're not decent. There's a vast chasm between being righteous and self-righteous.,How can a decent person personally <b>WORD</b> a child for speaking out against injustice? I expect this is a distraction from actually discussion policy.,They're not decent. There's a vast chasm between being righteous and self-righteous.,attack,protect,prevents,How can a decent person personally <b>PREVENTS</b> a child for speaking out against injustice? I expect this is a distraction from actually discussion policy.,They're not decent. There's a vast chasm between being righteous and self-righteous.,How can a decent person personally <b>PREVENTS</b> a child for speaking out against injustice? I expect this is a distraction from actually discussion policy.,They're not decent. There's a vast chasm between being righteous and self-righteous.,Incomplete,f2gca3t
95,verb,first,disagree,"That arm has weakened, that is known. The situation is alarming and it behooves us to take some action. So it comes down to one question, what can we do?",The scientists in this article are not convinced it has weakened,"That arm has weakened, that is known. The situation is alarming and it <b>WORD</b> us to take some action. So it comes down to one question, what can we do?",The scientists in this article are not convinced it has weakened,behooves,necessitates,outperform,"That arm has weakened, that is known. The situation is alarming and it <b>OUTPERFORM</b> us to take some action. So it comes down to one question, what can we do?",The scientists in this article are not convinced it has weakened,"That arm has weakened, that is known. The situation is alarming and it <b>OUTPERFORM</b> us to take some action. So it comes down to one question, what can we do?",The scientists in this article are not convinced it has weakened,Incomplete,gpk57x4
96,verb,first,disagree,"Energy storage will be cheap enough soon that most of these more complex options will seem dumb. Solar panels, batteries and heat pumps make biomass look dumb.","Haha true, it is a dirty solution. I'm not sure but solar panels aren't that efficient right?","Energy storage will be cheap enough soon that most of these more complex options will seem dumb. Solar panels, batteries and heat pumps <b>WORD</b> biomass look dumb.","Haha true, it is a dirty solution. I'm not sure but solar panels aren't that efficient right?",make,break,decarbonize,"Energy storage will be cheap enough soon that most of these more complex options will seem dumb. Solar panels, batteries and heat pumps <b>DECARBONIZE</b> biomass look dumb.","Haha true, it is a dirty solution. I'm not sure but solar panels aren't that efficient right?","Energy storage will be cheap enough soon that most of these more complex options will seem dumb. Solar panels, batteries and heat pumps <b>DECARBONIZE</b> biomass look dumb.","Haha true, it is a dirty solution. I'm not sure but solar panels aren't that efficient right?",Incomplete,fiwb09e
97,verb,first,disagree,"FYI, climate change had been happening since time immemorial, humans play a minuscule part in it. Not industrialized England, nor the USA, not even China can change it. All we can do is industrialize even more rapidly in order to survive the change.",FYI? Seriously? You don't think CO2 is a greenhouse gase? Why are sea levels rising at 40 times the rate for the 2000 years prior to 1850?,"FYI, climate change had been happening since time immemorial, humans play a minuscule part in it. Not industrialized England, nor the USA, not even China can change it. All we can do is <b>WORD</b> even more rapidly in order to survive the change.",FYI? Seriously? You don't think CO2 is a greenhouse gase? Why are sea levels rising at 40 times the rate for the 2000 years prior to 1850?,industrialize,deindustrialize,mitigated,"FYI, climate change had been happening since time immemorial, humans play a minuscule part in it. Not industrialized England, nor the USA, not even China can change it. All we can do is <b>MITIGATED</b> even more rapidly in order to survive the change.",FYI? Seriously? You don't think CO2 is a greenhouse gase? Why are sea levels rising at 40 times the rate for the 2000 years prior to 1850?,"FYI, climate change had been happening since time immemorial, humans play a minuscule part in it. Not industrialized England, nor the USA, not even China can change it. All we can do is <b>MITIGATED</b> even more rapidly in order to survive the change.",FYI? Seriously? You don't think CO2 is a greenhouse gase? Why are sea levels rising at 40 times the rate for the 2000 years prior to 1850?,Incomplete,d77ypcg
98,verb,first,disagree,"First, *don't* try to tell people that the severe crop shortages now forecast by the IPCC will all be solved by vertical farming, which remains a massively costly, energy-intensive thing to rely upon. veryone should care about it.","Once the cost of solar power falls another 60%, it will be economical to grow rice and vegetables inside. There is plenty of desert land to build solar panels and it will be cheaper than current food production.","First, *don't* try to tell people that the severe crop shortages now forecast by the IPCC will all be <b>WORD</b> by vertical farming, which remains a massively costly, energy-intensive thing to rely upon. veryone should care about it.","Once the cost of solar power falls another 60%, it will be economical to grow rice and vegetables inside. There is plenty of desert land to build solar panels and it will be cheaper than current food production.",solved,exacerbated,innovate,"First, *don't* try to tell people that the severe crop shortages now forecast by the IPCC will all be <b>INNOVATE</b> by vertical farming, which remains a massively costly, energy-intensive thing to rely upon. veryone should care about it.","Once the cost of solar power falls another 60%, it will be economical to grow rice and vegetables inside. There is plenty of desert land to build solar panels and it will be cheaper than current food production.","First, *don't* try to tell people that the severe crop shortages now forecast by the IPCC will all be <b>INNOVATE</b> by vertical farming, which remains a massively costly, energy-intensive thing to rely upon. veryone should care about it.","Once the cost of solar power falls another 60%, it will be economical to grow rice and vegetables inside. There is plenty of desert land to build solar panels and it will be cheaper than current food production.",Incomplete,ge1honj
99,verb,first,disagree,"Can someone do similar math on how much Googles and Facebooks of the tech world contribute to the global warming? Their data centers are energy monsters, besides influencing others also to copy them.",I'm not sure why you'd pick tech as the target for a question like this. Something like the trucking/shipping industry is going to completely dwarf modern tech firms because using some energy is always gong to be less bad that straight up burning the shit to move from A to B.,"Can someone do similar math on how much Googles and Facebooks of the tech world contribute to the global warming? Their data centers are energy monsters, besides influencing others also to <b>WORD</b> them.",I'm not sure why you'd pick tech as the target for a question like this. Something like the trucking/shipping industry is going to completely dwarf modern tech firms because using some energy is always gong to be less bad that straight up burning the shit to move from A to B.,copy,reduce,decreased,"Can someone do similar math on how much Googles and Facebooks of the tech world contribute to the global warming? Their data centers are energy monsters, besides influencing others also to <b>DECREASED</b> them.",I'm not sure why you'd pick tech as the target for a question like this. Something like the trucking/shipping industry is going to completely dwarf modern tech firms because using some energy is always gong to be less bad that straight up burning the shit to move from A to B.,"Can someone do similar math on how much Googles and Facebooks of the tech world contribute to the global warming? Their data centers are energy monsters, besides influencing others also to <b>DECREASED</b> them.",I'm not sure why you'd pick tech as the target for a question like this. Something like the trucking/shipping industry is going to completely dwarf modern tech firms because using some energy is always gong to be less bad that straight up burning the shit to move from A to B.,Incomplete,er1z4j7
100,verb,first,disagree,So even though air travel and car use etc has never been this low in a while and for multiple months the carbon dioxide levels still increased? Greta where u at,"The majority of emissions come from electricity generation and heat generation. So we're obviously still polluting. On top of that, the warming effect will also continue (but slow down) after we stop ALL pollutions of greenhouse gasses, including methane and cfcs. It will take more time after we stop polluting to actually come down, co2 will take literally thousands of years to fully leave the atmosphere and return to pre industrial levels",So even though air travel and car use etc has never been this low in a while and for multiple months the carbon dioxide levels still <b>WORD</b>? Greta where u at,"The majority of emissions come from electricity generation and heat generation. So we're obviously still polluting. On top of that, the warming effect will also continue (but slow down) after we stop ALL pollutions of greenhouse gasses, including methane and cfcs. It will take more time after we stop polluting to actually come down, co2 will take literally thousands of years to fully leave the atmosphere and return to pre industrial levels",increased,decreased,prevents,So even though air travel and car use etc has never been this low in a while and for multiple months the carbon dioxide levels still <b>PREVENTS</b>? Greta where u at,"The majority of emissions come from electricity generation and heat generation. So we're obviously still polluting. On top of that, the warming effect will also continue (but slow down) after we stop ALL pollutions of greenhouse gasses, including methane and cfcs. It will take more time after we stop polluting to actually come down, co2 will take literally thousands of years to fully leave the atmosphere and return to pre industrial levels",So even though air travel and car use etc has never been this low in a while and for multiple months the carbon dioxide levels still <b>PREVENTS</b>? Greta where u at,"The majority of emissions come from electricity generation and heat generation. So we're obviously still polluting. On top of that, the warming effect will also continue (but slow down) after we stop ALL pollutions of greenhouse gasses, including methane and cfcs. It will take more time after we stop polluting to actually come down, co2 will take literally thousands of years to fully leave the atmosphere and return to pre industrial levels",Incomplete,fsnax3h
101,verb,second,agree,Yes stupid people think everything's a hoax. The price they pay is them and their family get covid-19.,Yes stupid people think everything's a hoax. Except they also think 5G caused coronavirus.,Yes stupid people think everything's a hoax. The price they pay is them and their family get covid-19.,Yes stupid people think everything's a hoax. Except they also think 5G <b>WORD</b> coronavirus.,caused,prevented,blocking,Yes stupid people think everything's a hoax. The price they pay is them and their family get covid-19.,Yes stupid people think everything's a hoax. Except they also think 5G <b>BLOCKING</b> coronavirus.,Yes stupid people think everything's a hoax. The price they pay is them and their family get covid-19.,Yes stupid people think everything's a hoax. Except they also think 5G <b>BLOCKING</b> coronavirus.,Incomplete,fn36wdw
102,verb,second,agree,Yes please! Bullet trains e everywhere. Board them in 2 minutes and travel at hundreds of km an hour. A normal human being place to seat and the restaurant. Why did we spend so much in air infrastructure?,"Cars. Rail replaces GM, Ford, and Exxon. They have a distinct reason for pushing highway funding bills.",Yes please! Bullet trains e everywhere. Board them in 2 minutes and travel at hundreds of km an hour. A normal human being place to seat and the restaurant. Why did we spend so much in air infrastructure?,"Cars. Rail replaces GM, Ford, and Exxon. They have a distinct reason for <b>WORD</b> highway funding bills.",pushing,pulling,maintain,Yes please! Bullet trains e everywhere. Board them in 2 minutes and travel at hundreds of km an hour. A normal human being place to seat and the restaurant. Why did we spend so much in air infrastructure?,"Cars. Rail replaces GM, Ford, and Exxon. They have a distinct reason for <b>MAINTAIN</b> highway funding bills.",Yes please! Bullet trains e everywhere. Board them in 2 minutes and travel at hundreds of km an hour. A normal human being place to seat and the restaurant. Why did we spend so much in air infrastructure?,"Cars. Rail replaces GM, Ford, and Exxon. They have a distinct reason for <b>MAINTAIN</b> highway funding bills.",Incomplete,d82kwbb
103,verb,second,agree,Desalination is a highly energy-intensive process and most of our energy is still quite dirty and produces a lot of carbon(around 2 lb/kwh). You would end up producing far more carbon through desalination(using the current energy infrastructure) than would be sunk in newly formed wetlands and forests.,"Obviously it'd be counterproductive to do it with new fossil power. Renewables or nuclear would be fine...though if it's a choice between that or using them to displace coal plants, it's probably best to do the latter first.",Desalination is a highly energy-intensive process and most of our energy is still quite dirty and produces a lot of carbon(around 2 lb/kwh). You would end up producing far more carbon through desalination(using the current energy infrastructure) than would be sunk in newly formed wetlands and forests.,"Obviously it'd be counterproductive to do it with new fossil power. Renewables or nuclear would be fine...though if it's a choice between that or using them to <b>WORD</b> coal plants, it's probably best to do the latter first.",displace,shut,ignores,Desalination is a highly energy-intensive process and most of our energy is still quite dirty and produces a lot of carbon(around 2 lb/kwh). You would end up producing far more carbon through desalination(using the current energy infrastructure) than would be sunk in newly formed wetlands and forests.,"Obviously it'd be counterproductive to do it with new fossil power. Renewables or nuclear would be fine...though if it's a choice between that or using them to <b>IGNORES</b> coal plants, it's probably best to do the latter first.",Desalination is a highly energy-intensive process and most of our energy is still quite dirty and produces a lot of carbon(around 2 lb/kwh). You would end up producing far more carbon through desalination(using the current energy infrastructure) than would be sunk in newly formed wetlands and forests.,"Obviously it'd be counterproductive to do it with new fossil power. Renewables or nuclear would be fine...though if it's a choice between that or using them to <b>IGNORES</b> coal plants, it's probably best to do the latter first.",Incomplete,crhg92p
104,verb,second,agree,"CO2 usually peaks in El Nino years - it could very well drop to 399.9 next year! But, it's a moot point anyways, we will have 400ppm now, and soon enough 450ppm,, and then 550ppm, and then 7-900ppm (with the current emission commitments set by 180+ countries before the Paris summit).","Yeah, it goes up 5 ppm in the (northern hemisphere) winter and down 5 ppm in summer. NOAA already accounts for this and sets a yearly corrected monthly mean which for October was 401.58.","CO2 usually peaks in El Nino years - it could very well drop to 399.9 next year! But, it's a moot point anyways, we will have 400ppm now, and soon enough 450ppm,, and then 550ppm, and then 7-900ppm (with the current emission commitments set by 180+ countries before the Paris summit).","Yeah, it goes up 5 ppm in the (northern hemisphere) winter and down 5 ppm in summer. NOAA already <b>WORD</b> for this and sets a yearly corrected monthly mean which for October was 401.58.",accounts,disputes,pardon,"CO2 usually peaks in El Nino years - it could very well drop to 399.9 next year! But, it's a moot point anyways, we will have 400ppm now, and soon enough 450ppm,, and then 550ppm, and then 7-900ppm (with the current emission commitments set by 180+ countries before the Paris summit).","Yeah, it goes up 5 ppm in the (northern hemisphere) winter and down 5 ppm in summer. NOAA already <b>PARDON</b> for this and sets a yearly corrected monthly mean which for October was 401.58.","CO2 usually peaks in El Nino years - it could very well drop to 399.9 next year! But, it's a moot point anyways, we will have 400ppm now, and soon enough 450ppm,, and then 550ppm, and then 7-900ppm (with the current emission commitments set by 180+ countries before the Paris summit).","Yeah, it goes up 5 ppm in the (northern hemisphere) winter and down 5 ppm in summer. NOAA already <b>PARDON</b> for this and sets a yearly corrected monthly mean which for October was 401.58.",Incomplete,cwwrj10
105,verb,second,agree,The only solution is to go medieval on the fossil fuel industry. Have the government take over. Use their money to fund the big switch. Shut down pumps as soon as possible. It's extreme but the fossil fuel industry's funding of climate change denial is why we're on this mess.,Make ecocide a thing for which oil execs are personally criminally liable. jail every last one of them.,The only solution is to go medieval on the fossil fuel industry. Have the government take over. Use their money to fund the big switch. Shut down pumps as soon as possible. It's extreme but the fossil fuel industry's funding of climate change denial is why we're on this mess.,Make ecocide a thing for which oil execs are personally criminally liable. <b>WORD</b> every last one of them.,jail,pardon,trapping,The only solution is to go medieval on the fossil fuel industry. Have the government take over. Use their money to fund the big switch. Shut down pumps as soon as possible. It's extreme but the fossil fuel industry's funding of climate change denial is why we're on this mess.,Make ecocide a thing for which oil execs are personally criminally liable. <b>TRAPPING</b> every last one of them.,The only solution is to go medieval on the fossil fuel industry. Have the government take over. Use their money to fund the big switch. Shut down pumps as soon as possible. It's extreme but the fossil fuel industry's funding of climate change denial is why we're on this mess.,Make ecocide a thing for which oil execs are personally criminally liable. <b>TRAPPING</b> every last one of them.,Incomplete,f8wikzy
106,verb,second,agree,I honestly thought Methane was doing more harm to the climate than CO2 is that wrong?,"my understanding is that methane has a greater warming effect but is secondary to the CO2 produced by human activity. we're learning that live stock kept for human use produces a lot of methane. even worse, warming is releasing a lot of methane trapped by ice etc so the warming power of methane than increased",I honestly thought Methane was doing more harm to the climate than CO2 is that wrong?,"my understanding is that methane has a greater warming effect but is secondary to the CO2 produced by human activity. we're learning that live stock kept for human use produces a lot of methane. even worse, warming is <b>WORD</b> a lot of methane trapped by ice etc so the warming power of methane than increased",releasing,absorbing,ignores,I honestly thought Methane was doing more harm to the climate than CO2 is that wrong?,"my understanding is that methane has a greater warming effect but is secondary to the CO2 produced by human activity. we're learning that live stock kept for human use produces a lot of methane. even worse, warming is <b>IGNORES</b> a lot of methane trapped by ice etc so the warming power of methane than increased",I honestly thought Methane was doing more harm to the climate than CO2 is that wrong?,"my understanding is that methane has a greater warming effect but is secondary to the CO2 produced by human activity. we're learning that live stock kept for human use produces a lot of methane. even worse, warming is <b>IGNORES</b> a lot of methane trapped by ice etc so the warming power of methane than increased",Incomplete,dj5f23d
107,verb,second,agree,They're only proposing an option for a temporary halt. This is not a permanent solution. A twenty year pushback on global warming would help an awful lot towards enabling all the crazy infrastructural adjustments we need to make in order to create modern economies without destabilizing the global economy.,"We need to take a WWII level of interest in this issue, as in everyone does their part because this affects everyone. It needs to be a multi-front effort - lifestyle changes in large populations to reduce pollution and emissions, and large scale projects like these working in tandem with one another.",They're only proposing an option for a temporary halt. This is not a permanent solution. A twenty year pushback on global warming would help an awful lot towards enabling all the crazy infrastructural adjustments we need to make in order to create modern economies without destabilizing the global economy.,"We need to take a WWII level of interest in this issue, as in everyone does their part because this <b>WORD</b> everyone. It needs to be a multi-front effort - lifestyle changes in large populations to reduce pollution and emissions, and large scale projects like these working in tandem with one another.",affects,ignores,remove,They're only proposing an option for a temporary halt. This is not a permanent solution. A twenty year pushback on global warming would help an awful lot towards enabling all the crazy infrastructural adjustments we need to make in order to create modern economies without destabilizing the global economy.,"We need to take a WWII level of interest in this issue, as in everyone does their part because this <b>REMOVE</b> everyone. It needs to be a multi-front effort - lifestyle changes in large populations to reduce pollution and emissions, and large scale projects like these working in tandem with one another.",They're only proposing an option for a temporary halt. This is not a permanent solution. A twenty year pushback on global warming would help an awful lot towards enabling all the crazy infrastructural adjustments we need to make in order to create modern economies without destabilizing the global economy.,"We need to take a WWII level of interest in this issue, as in everyone does their part because this <b>REMOVE</b> everyone. It needs to be a multi-front effort - lifestyle changes in large populations to reduce pollution and emissions, and large scale projects like these working in tandem with one another.",Incomplete,f519jk3
108,verb,second,agree,"That's a nice start but you want me to be interested, don't stop at storing energy in hydrogen. Attach a bunch of hydrogens to a carbon and make a fuel that is practical to store, transport and burn in conventional infrastructure. Then I'm all ears.","Isn't this just the Sabtier process? Which is well known since at least a century, proven, used, just not competitive with just pumping it out of the ground. add a reasonable carbon tax though....","That's a nice start but you want me to be interested, don't stop at storing energy in hydrogen. Attach a bunch of hydrogens to a carbon and make a fuel that is practical to store, transport and burn in conventional infrastructure. Then I'm all ears.","Isn't this just the Sabtier process? Which is well known since at least a century, proven, used, just not competitive with just pumping it out of the ground. <b>WORD</b> a reasonable carbon tax though....",add,subtract,releases,"That's a nice start but you want me to be interested, don't stop at storing energy in hydrogen. Attach a bunch of hydrogens to a carbon and make a fuel that is practical to store, transport and burn in conventional infrastructure. Then I'm all ears.","Isn't this just the Sabtier process? Which is well known since at least a century, proven, used, just not competitive with just pumping it out of the ground. <b>RELEASES</b> a reasonable carbon tax though....","That's a nice start but you want me to be interested, don't stop at storing energy in hydrogen. Attach a bunch of hydrogens to a carbon and make a fuel that is practical to store, transport and burn in conventional infrastructure. Then I'm all ears.","Isn't this just the Sabtier process? Which is well known since at least a century, proven, used, just not competitive with just pumping it out of the ground. <b>RELEASES</b> a reasonable carbon tax though....",Incomplete,fp9wk9s
