sr,case,turn_masked,agree/disagree,speaker_a_original,speaker_b_original,speaker_a_task_1,speaker_b_task_1,masked_word,llama_selection,gemma_pred,speaker_a_task_2,speaker_b_task_2,speaker_a_task_3,speaker_b_task_3,status,msg_id
198,temporal,second,disagree,Did you know that electricity is generated by burning natural gas in the power plant? The irony...,"Heat pumps deliver around 3 units of heat for every unit of electricity they consume. So even if they were powered completely by 50% efficient gas turbines, the end-to-end efficiency would be around 150%, compared to around 90% for a good gas fired boiler. And that's before renewables displace gas power",Did you know that electricity is generated by burning natural gas in the power plant? The irony...,"Heat pumps deliver around 3 units of heat for every unit of electricity they consume. So even if they were powered completely by 50% efficient gas turbines, the end-to-end efficiency would be around 150%, compared to around 90% for a good gas fired boiler. And that's <b>WORD</b> renewables displace gas power",before,after,ever,Did you know that electricity is generated by burning natural gas in the power plant? The irony...,"Heat pumps deliver around 3 units of heat for every unit of electricity they consume. So even if they were powered completely by 50% efficient gas turbines, the end-to-end efficiency would be around 150%, compared to around 90% for a good gas fired boiler. And that's <b>EVER</b> renewables displace gas power",Did you know that electricity is generated by burning natural gas in the power plant? The irony...,"Heat pumps deliver around 3 units of heat for every unit of electricity they consume. So even if they were powered completely by 50% efficient gas turbines, the end-to-end efficiency would be around 150%, compared to around 90% for a good gas fired boiler. And that's <b>EVER</b> renewables displace gas power",Incomplete,gi8scuh
199,temporal,second,disagree,"Lets talk about making fuel out of all the biomass that gets thrown in the garbage every day, or maybe lifting city ordnance's that are against residents using wind turbines on their property, or collecting rain water.","Silicon is technically finite. Lithium is finite. A lot of technologies are not very sustainable right now, including solar panels. I'm sorry, but I feel like I disagree your entire comment, except for the city ordinances, that's infuriating that they won't allow residents to do that.","Lets talk about making fuel out of all the biomass that gets thrown in the garbage every day, or maybe lifting city ordnance's that are against residents using wind turbines on their property, or collecting rain water.","Silicon is technically finite. Lithium is finite. A lot of technologies are not very sustainable right <b>WORD</b>, including solar panels. I'm sorry, but I feel like I disagree your entire comment, except for the city ordinances, that's infuriating that they won't allow residents to do that.",now,ever,because,"Lets talk about making fuel out of all the biomass that gets thrown in the garbage every day, or maybe lifting city ordnance's that are against residents using wind turbines on their property, or collecting rain water.","Silicon is technically finite. Lithium is finite. A lot of technologies are not very sustainable right <b>BECAUSE</b>, including solar panels. I'm sorry, but I feel like I disagree your entire comment, except for the city ordinances, that's infuriating that they won't allow residents to do that.","Lets talk about making fuel out of all the biomass that gets thrown in the garbage every day, or maybe lifting city ordnance's that are against residents using wind turbines on their property, or collecting rain water.","Silicon is technically finite. Lithium is finite. A lot of technologies are not very sustainable right <b>BECAUSE</b>, including solar panels. I'm sorry, but I feel like I disagree your entire comment, except for the city ordinances, that's infuriating that they won't allow residents to do that.",Incomplete,fkgmm1u
200,temporal,second,disagree,Greta wants us to go vegan like she has. I agree. It's our responsibility.,"No it's the state's responsibility to regulate carbon emission. Personal action can only go so far, while coal and oil companies go unchecked.",Greta wants us to go vegan like she has. I agree. It's our responsibility.,"No it's the state's responsibility to regulate carbon emission. Personal action can only go so far, <b>WORD</b> coal and oil companies go unchecked.",while,before,and,Greta wants us to go vegan like she has. I agree. It's our responsibility.,"No it's the state's responsibility to regulate carbon emission. Personal action can only go so far, <b>AND</b> coal and oil companies go unchecked.",Greta wants us to go vegan like she has. I agree. It's our responsibility.,"No it's the state's responsibility to regulate carbon emission. Personal action can only go so far, <b>AND</b> coal and oil companies go unchecked.",Incomplete,f06ufv4
201,connector,first,agree,"Its not hopeless, but also don't buy real estate on the coast of Florida. Maybe get involved in the next election. Work with people organizing to make a change for actually fighting climate crisis. I'm hopeful on that because in the decades before it was all shallow bs being pitched against climate crisis. For the first time there is a possibility of actual action.","Absolutely, I'm hopeful for that reason too! We're starting to have a more robust discussion than ever before, and candidates running for all levels of office know they have to come to the table with real plans to tackle the issue.","Its not hopeless, <b>WORD</b> also don't buy real estate on the coast of Florida. Maybe get involved in the next election. Work with people organizing to make a change for actually fighting climate crisis. I'm hopeful on that because in the decades before it was all shallow bs being pitched against climate crisis. For the first time there is a possibility of actual action.","Absolutely, I'm hopeful for that reason too! We're starting to have a more robust discussion than ever before, and candidates running for all levels of office know they have to come to the table with real plans to tackle the issue.",but,yet,and,"Its not hopeless, <b>AND</b> also don't buy real estate on the coast of Florida. Maybe get involved in the next election. Work with people organizing to make a change for actually fighting climate crisis. I'm hopeful on that because in the decades before it was all shallow bs being pitched against climate crisis. For the first time there is a possibility of actual action.","Absolutely, I'm hopeful for that reason too! We're starting to have a more robust discussion than ever before, and candidates running for all levels of office know they have to come to the table with real plans to tackle the issue.","Its not hopeless, <b>AND</b> also don't buy real estate on the coast of Florida. Maybe get involved in the next election. Work with people organizing to make a change for actually fighting climate crisis. I'm hopeful on that because in the decades before it was all shallow bs being pitched against climate crisis. For the first time there is a possibility of actual action.","Absolutely, I'm hopeful for that reason too! We're starting to have a more robust discussion than ever before, and candidates running for all levels of office know they have to come to the table with real plans to tackle the issue.",Incomplete,ez6och7
202,connector,first,agree,"This is the next step in the conservative response to climate change: OK, it's real and totally man-made, but it's too late to stop it now so let's just double down on big business and enjoy the time we (the uber-rich) have left.","Nah, the rich will be fine. We gonna be like Elysium, I shit you not. Rich will be chillin' in space, on mars, and we gonna be stuck down here.","This is the next step in the conservative response to climate change: OK, it's real and totally man-made, <mask> it's too late to stop it now so let's just double down on big business and enjoy the time we (the uber-rich) have left.","Nah, the rich will be fine. We gonna be like Elysium, I shit you not. Rich will be chillin' in space, on mars, and we gonna be stuck down here.",but,however,or,"This is the next step in the conservative response to climate change: OK, it's real and totally man-made, <mask> it's too late to stop it now so let's just double down on big business and enjoy the time we (the uber-rich) have left.","Nah, the rich will be fine. We gonna be like Elysium, I shit you not. Rich will be chillin' in space, on mars, and we gonna be stuck down here.","This is the next step in the conservative response to climate change: OK, it's real and totally man-made, <mask> it's too late to stop it now so let's just double down on big business and enjoy the time we (the uber-rich) have left.","Nah, the rich will be fine. We gonna be like Elysium, I shit you not. Rich will be chillin' in space, on mars, and we gonna be stuck down here.",Incomplete,d6pp34u
203,connector,first,agree,"And yet America seems to be on the brink of electing Trump and Pence - both Human-Caused Climate Change **deniers** 4 years of not only doing nothing to help the climate, but letting corporations rape the environment - just like Bush.","Earth will be fine after several million years...It's already too late to make any real change, scientists all know this but can't/won't say anything. Let us live the next 100yrs in extreme prosperity and then it's all over.","And yet America seems to be on the brink of electing Trump and Pence - both Human-Caused Climate Change **deniers** 4 years of not only doing nothing to help the climate, <b>WORD</b> letting corporations rape the environment - just like Bush.","Earth will be fine after several million years...It's already too late to make any real change, scientists all know this but can't/won't say anything. Let us live the next 100yrs in extreme prosperity and then it's all over.",but,however,and,"And yet America seems to be on the brink of electing Trump and Pence - both Human-Caused Climate Change <b>deniers</b> 4 years of not only doing nothing to help the climate, **AND** letting corporations rape the environment - just like Bush.","Earth will be fine after several million years...It's already too late to make any real change, scientists all know this but can't/won't say anything. Let us live the next 100yrs in extreme prosperity and then it's all over.","And yet America seems to be on the brink of electing Trump and Pence - both Human-Caused Climate Change <b>deniers</b> 4 years of not only doing nothing to help the climate, **AND** letting corporations rape the environment - just like Bush.","Earth will be fine after several million years...It's already too late to make any real change, scientists all know this but can't/won't say anything. Let us live the next 100yrs in extreme prosperity and then it's all over.",Incomplete,d7bzkqg
204,connector,first,agree,"I'm hoping this won't be another Medicare for all situation where most people want it, but corporate donors don't let it happen.","Then it's up to the people to DEMAND it happen, boycott the companies.","I'm hoping this won't be another Medicare for all situation where most people want it, <b>WORD</b> corporate donors don't let it happen.","Then it's up to the people to DEMAND it happen, boycott the companies.",but,however,and,"I'm hoping this won't be another Medicare for all situation where most people want it, <b>AND</b> corporate donors don't let it happen.","Then it's up to the people to DEMAND it happen, boycott the companies.","I'm hoping this won't be another Medicare for all situation where most people want it, <b>AND</b> corporate donors don't let it happen.","Then it's up to the people to DEMAND it happen, boycott the companies.",Incomplete,gayes46
205,connector,first,agree,"The Army corp of engineers guy. wow He appears to be tasked to rebuild the levees and maintain them but he can't talk about PAST flood frequency because he is not an expert. If he can't even talk about past flood frequency because he is not and expert, how in the world can he design flood protection that withstand the floods of the future? The dereliction of duty displayed here is nauseating.",USACE has duty to provide the public good advice. To fail on this issue is truly astounding failure.,"The Army corp of engineers guy. wow He appears to be tasked to rebuild the levees and maintain them <b>WORD</b> he can't talk about PAST flood frequency because he is not an expert. If he can't even talk about past flood frequency because he is not and expert, how in the world can he design flood protection that withstand the floods of the future? The dereliction of duty displayed here is nauseating.",USACE has duty to provide the public good advice. To fail on this issue is truly astounding failure.,but,however,because,"The Army corp of engineers guy. wow He appears to be tasked to rebuild the levees and maintain them <b>BECAUSE</b> he can't talk about PAST flood frequency because he is not an expert. If he can't even talk about past flood frequency because he is not and expert, how in the world can he design flood protection that withstand the floods of the future? The dereliction of duty displayed here is nauseating.",USACE has duty to provide the public good advice. To fail on this issue is truly astounding failure.,"The Army corp of engineers guy. wow He appears to be tasked to rebuild the levees and maintain them <b>BECAUSE</b> he can't talk about PAST flood frequency because he is not an expert. If he can't even talk about past flood frequency because he is not and expert, how in the world can he design flood protection that withstand the floods of the future? The dereliction of duty displayed here is nauseating.",USACE has duty to provide the public good advice. To fail on this issue is truly astounding failure.,Incomplete,ev2piwg
206,connector,first,agree,"Blaming Trump for the environmental situation is fucking ridiculous. Yeah he'll make things worse, but this has been decades in the making. I wonder, how many people complaining about Trump still eat meat, fly on planes, and buy mountains of plastic crap every year?","Right now is our last chance, the window is closing. Trump is ensuring there is no way back. He will own that.","Blaming Trump for the environmental situation is fucking ridiculous. Yeah he'll make things worse, <b>WORD</b> this has been decades in the making. I wonder, how many people complaining about Trump still eat meat, fly on planes, and buy mountains of plastic crap every year?","Right now is our last chance, the window is closing. Trump is ensuring there is no way back. He will own that.",but,however,but,"Blaming Trump for the environmental situation is fucking ridiculous. Yeah he'll make things worse, <b>BUT</b> this has been decades in the making. I wonder, how many people complaining about Trump still eat meat, fly on planes, and buy mountains of plastic crap every year?","Right now is our last chance, the window is closing. Trump is ensuring there is no way back. He will own that.","Blaming Trump for the environmental situation is fucking ridiculous. Yeah he'll make things worse, <b>BUT</b> this has been decades in the making. I wonder, how many people complaining about Trump still eat meat, fly on planes, and buy mountains of plastic crap every year?","Right now is our last chance, the window is closing. Trump is ensuring there is no way back. He will own that.",Incomplete,dfkmc2w
207,connector,first,agree,"I know our society is highly divided, and that being unable to forgive hurts the situation even more, but how do we forgive the average Republican politician and voter for what they've done for 30 years?","REALLY wished I knew the answer to this, I hear you and I just don't have a good answer.","I know our society is highly divided, <b>WORD</b> that being unable to forgive hurts the situation even more, but how do we forgive the average Republican politician and voter for what they've done for 30 years?","REALLY wished I knew the answer to this, I hear you and I just don't have a good answer.",and,or,unless,"I know our society is highly divided, <b>UNLESS</b> that being unable to forgive hurts the situation even more, but how do we forgive the average Republican politician and voter for what they've done for 30 years?","REALLY wished I knew the answer to this, I hear you and I just don't have a good answer.","I know our society is highly divided, <b>UNLESS</b> that being unable to forgive hurts the situation even more, but how do we forgive the average Republican politician and voter for what they've done for 30 years?","REALLY wished I knew the answer to this, I hear you and I just don't have a good answer.",Incomplete,fal21sv
208,connector,first,agree,We could unfuck ourselves but we won't because it would be bad for our living standard.,"Exactly, it would essentially require a complete collapse of the system and most people would sooner face extinction than face a world without fossil fuel powered production. We will be burning coal and oil until we take our last breath.",We could unfuck ourselves but we won't <b>WORD</b> it would be bad for our living standard.,"Exactly, it would essentially require a complete collapse of the system and most people would sooner face extinction than face a world without fossil fuel powered production. We will be burning coal and oil until we take our last breath.",because,because,unless,We could unfuck ourselves but we won't <b>UNLESS</b> it would be bad for our living standard.,"Exactly, it would essentially require a complete collapse of the system and most people would sooner face extinction than face a world without fossil fuel powered production. We will be burning coal and oil until we take our last breath.",We could unfuck ourselves but we won't <b>UNLESS</b> it would be bad for our living standard.,"Exactly, it would essentially require a complete collapse of the system and most people would sooner face extinction than face a world without fossil fuel powered production. We will be burning coal and oil until we take our last breath.",Incomplete,crdq0fg
209,connector,first,agree,"There are so many low hanging fruit to reduce emissions that are simply ignored because they're not sexy but could make a huge difference. Insulation, heating etc.","Go vegan, single biggest impact an individual can have on their emissions","There are so many low hanging fruit to reduce emissions that are simply ignored <b>WORD</b> they're not sexy but could make a huge difference. Insulation, heating etc.","Go vegan, single biggest impact an individual can have on their emissions",because,despite,but,"There are so many low hanging fruit to reduce emissions that are simply ignored <b>BUT</b> they're not sexy but could make a huge difference. Insulation, heating etc.","Go vegan, single biggest impact an individual can have on their emissions","There are so many low hanging fruit to reduce emissions that are simply ignored <b>BUT</b> they're not sexy but could make a huge difference. Insulation, heating etc.","Go vegan, single biggest impact an individual can have on their emissions",Incomplete,fdmupkq
210,connector,first,agree,"This would just be a drop in the bucket. We need to abolish the system whose sole goal is growth and reform our societies to live with post-growth economics. That means getting rid of capitalism, which will never happen, so we're pretty much screwed. Enjoy life while it lasts :)","Yep. Unless we as an entire species adopt an eco socialist economy pretty much *NOW* then we can look forward to human extinction in a matter of a few generations. Sayonara, Homo Sapiens, you had a really stupid and shitty run.","This would just be a drop in the bucket. We need to abolish the system whose sole goal is growth and reform our societies to live with post-growth economics. That means getting rid of capitalism, which will never happen, <b>WORD</b> we're pretty much screwed. Enjoy life while it lasts :)","Yep. Unless we as an entire species adopt an eco socialist economy pretty much *NOW* then we can look forward to human extinction in a matter of a few generations. Sayonara, Homo Sapiens, you had a really stupid and shitty run.",so,however,but,"This would just be a drop in the bucket. We need to abolish the system whose sole goal is growth and reform our societies to live with post-growth economics. That means getting rid of capitalism, which will never happen, <b>BUT</b> we're pretty much screwed. Enjoy life while it lasts :)","Yep. Unless we as an entire species adopt an eco socialist economy pretty much *NOW* then we can look forward to human extinction in a matter of a few generations. Sayonara, Homo Sapiens, you had a really stupid and shitty run.","This would just be a drop in the bucket. We need to abolish the system whose sole goal is growth and reform our societies to live with post-growth economics. That means getting rid of capitalism, which will never happen, <b>BUT</b> we're pretty much screwed. Enjoy life while it lasts :)","Yep. Unless we as an entire species adopt an eco socialist economy pretty much *NOW* then we can look forward to human extinction in a matter of a few generations. Sayonara, Homo Sapiens, you had a really stupid and shitty run.",Incomplete,flzzsnn
211,connector,first,disagree,"Imagine if all those people spent one extra day, working and then donating the salary from that day to organisations that plant trees. That would have made a difference.","Every year ca 278 billion dollars gets donated by Americans, yet every hour 19000 children die around the world due to poverty. Donations do not fix the system which creates the need for people's charity.","Imagine if all those people spent one extra day, working <b>WORD</b> then donating the salary from that day to organisations that plant trees. That would have made a difference.","Every year ca 278 billion dollars gets donated by Americans, yet every hour 19000 children die around the world due to poverty. Donations do not fix the system which creates the need for people's charity.",and,but,and,"Imagine if all those people spent one extra day, working <b>AND</b> then donating the salary from that day to organisations that plant trees. That would have made a difference.","Every year ca 278 billion dollars gets donated by Americans, yet every hour 19000 children die around the world due to poverty. Donations do not fix the system which creates the need for people's charity.","Imagine if all those people spent one extra day, working <b>AND</b> then donating the salary from that day to organisations that plant trees. That would have made a difference.","Every year ca 278 billion dollars gets donated by Americans, yet every hour 19000 children die around the world due to poverty. Donations do not fix the system which creates the need for people's charity.",Incomplete,f0wzje4
212,connector,first,disagree,"Elon's a bit if a dick sometimes, but the world needs dicks like this. More power to him.",I really don't think we need Elon musk. He's just a con man.,"Elon's a bit if a dick sometimes, <b>WORD</b> the world needs dicks like this. More power to him.",I really don't think we need Elon musk. He's just a con man.,but,however,but,"Elon's a bit if a dick sometimes, <b>BUT</b> the world needs dicks like this. More power to him.",I really don't think we need Elon musk. He's just a con man.,"Elon's a bit if a dick sometimes, <b>BUT</b> the world needs dicks like this. More power to him.",I really don't think we need Elon musk. He's just a con man.,Incomplete,gk59jx8
213,connector,first,disagree,"I don't wish any suffering on the people of the world, but we cannot continue trying to sustain the unsustainable. The way we treat our home is despicable and we don't deserve another second here.","I think we do deserve another second here, I think we deserve to keep living on this planet for millennia, at least some of us.","I don't wish any suffering on the people of the world, but we cannot continue trying to sustain the unsustainable. The way we treat our home is despicable <b>WORD</b> we don't deserve another second here.","I think we do deserve another second here, I think we deserve to keep living on this planet for millennia, at least some of us.",and,or,although,"I don't wish any suffering on the people of the world, but we cannot continue trying to sustain the unsustainable. The way we treat our home is despicable <b>ALTHOUGH</b> we don't deserve another second here.","I think we do deserve another second here, I think we deserve to keep living on this planet for millennia, at least some of us.","I don't wish any suffering on the people of the world, but we cannot continue trying to sustain the unsustainable. The way we treat our home is despicable <b>ALTHOUGH</b> we don't deserve another second here.","I think we do deserve another second here, I think we deserve to keep living on this planet for millennia, at least some of us.",Incomplete,ct2qrqu
